S/N,Subject,Topic,Scenario,Question and Answer
1,Biological and Biochemical Foundations of Living Systems,Principles of bioenergetics and fuel molecule metabolism,"### Analytical Question: Glycolysis

**Scenario:**

You are examining glycolysis, the metabolic pathway that converts glucose into pyruvate, while generating ATP and NADH. The following table summarizes important steps in glycolysis, their key enzymes, and the energy changes involved:

| Step | Substrate              | Product               | Enzyme                | ATP Change   |
|------|-----------------------|-----------------------|-----------------------|--------------|
| 1    | Glucose               | Glucose-6-phosphate   | Hexokinase            | -1 ATP       |
| 3    | Fructose-6-phosphate  | Fructose-1,6-bisphosphate | Phosphofructokinase | -1 ATP       |
| 7    | 1,3-Bisphosphoglycerate | 3-Phosphoglycerate   | Phosphoglycerate kinase | +1 ATP     |
| 10   | Phosphoenolpyruvate   | Pyruvate              | Pyruvate kinase       | +1 ATP       |

","**Question: What conclusions can be drawn from these data regarding the regulation and energetic efficiency of glycolysis?** A) The irreversible steps in glycolysis (such as those catalyzed by hexokinase and phosphofructokinase) are crucial regulatory points that ensure the pathway proceeds efficiently under varying cellular conditions.  
B) The net gain of ATP from glycolysis is high due to the production of ATP in the energy payoff phase, which compensates for the ATP consumed in the energy investment phase.  
C) The conversion of glucose to pyruvate via glycolysis results in a significant increase in free energy, making the pathway energetically unfavorable under standard conditions.  
D) The production of NADH during glycolysis is critical for ATP generation, but it requires additional processes such as oxidative phosphorylation to be utilized effectively for energy.

### Correct Answer: A) The irreversible steps in glycolysis (such as those catalyzed by hexokinase and phosphofructokinase) are crucial regulatory points that ensure the pathway proceeds efficiently under varying cellular conditions.

### Justification and Analysis:

- **Option A:** **Correct.** The irreversible steps, particularly those catalyzed by hexokinase and phosphofructokinase, serve as key regulatory points in glycolysis. These steps are tightly regulated by various factors (e.g., substrate availability, energy status of the cell) to ensure that glycolysis responds appropriately to the metabolic needs of the cell.

- **Option B:** **Incorrect.** While glycolysis does produce ATP during the energy payoff phase, the net gain of ATP is only 2 ATP per glucose molecule (4 ATP produced minus 2 ATP consumed). This is not considered ""high"" in terms of energy yield, especially when compared to other metabolic pathways.

- **Option C:** **Incorrect.** The conversion of glucose to pyruvate is energetically favorable overall, as the free energy change (?G) is negative. Glycolysis proceeds under standard conditions and is driven by the energy released during the conversion of glucose into pyruvate, making it a favorable process in cellular metabolism.

- **Option D:** **Incorrect.** While NADH production is important, it does not directly generate ATP during glycolysis. Instead, NADH must be reoxidized to NAD+ through processes such as fermentation or oxidative phosphorylation to continue ATP production. Therefore, the effectiveness of NADH in contributing to ATP generation relies on additional metabolic pathways.

This question tests the understanding of glycolysis regulation, energy changes, and the interplay between different metabolic processes, requiring critical analysis of the pathway's efficiency and regulatory mechanisms.

"
2,Biological and Biochemical Foundations of Living Systems,Principles of bioenergetics and fuel molecule metabolism,"### Analytical Question: Gluconeogenesis

**Scenario:**

You are studying gluconeogenesis, the metabolic pathway that synthesizes glucose from non-carbohydrate precursors. The following table summarizes key substrates, their roles, and the energy requirements of gluconeogenesis:

| Substrate              | Role in Gluconeogenesis         | ATP Required | GTP Required | Key Enzyme                     |
|-----------------------|----------------------------------|--------------|--------------|--------------------------------|
| Pyruvate              | Converted to oxaloacetate       | 6 ATP        | 2 GTP        | Pyruvate carboxylase          |
| Lactate               | Converted to pyruvate           | 0 ATP        | 0 GTP        | Lactate dehydrogenase         |
| Glycerol              | Converted to dihydroxyacetone phosphate | 1 ATP   | 0 GTP        | Glycerol kinase                |
| Glucogenic amino acids | Converted to various intermediates | 0 ATP      | 0 GTP        | Various transaminases         |

","**Question: What conclusions can be drawn from these data regarding the energetic cost and regulatory mechanisms of gluconeogenesis?**

A) Gluconeogenesis is an energy-consuming process that requires a significant input of ATP and GTP, which makes it energetically unfavorable compared to glycolysis.  
B) The conversion of lactate to glucose via gluconeogenesis is a net energy-neutral process, allowing for efficient recycling of metabolites without ATP expenditure.  
C) Pyruvate carboxylase is a critical regulatory enzyme in gluconeogenesis, as it catalyzes the first step and is activated by high levels of acetyl-CoA, linking gluconeogenesis to fatty acid metabolism.  
D) Glycerol can be utilized in gluconeogenesis without any energy cost, enabling efficient glucose production from triglycerides.

### Correct Answer: A) Gluconeogenesis is an energy-consuming process that requires a significant input of ATP and GTP, which makes it energetically unfavorable compared to glycolysis.

### Justification and Analysis:

- **Option A:** **Correct.** Gluconeogenesis is indeed an energy-consuming process, requiring 6 ATP and 2 GTP for each glucose molecule synthesized from pyruvate. This high energy requirement makes gluconeogenesis energetically unfavorable compared to glycolysis, which primarily generates ATP.

- **Option B:** **Incorrect.** The conversion of lactate to pyruvate does not require ATP, but overall, gluconeogenesis from lactate still consumes significant energy in subsequent steps. Therefore, it cannot be classified as a net energy-neutral process in the context of the entire pathway.

- **Option C:** **Correct but Incomplete.** While it is true that pyruvate carboxylase is a key regulatory enzyme in gluconeogenesis and is activated by acetyl-CoA, this statement does not encompass the full energetic implications of gluconeogenesis compared to glycolysis.

- **Option D:** **Incorrect.** Glycerol does require one ATP for phosphorylation to dihydroxyacetone phosphate, which means that its use in gluconeogenesis is not without cost. Therefore, it cannot be said that glycerol can be utilized without any energy expenditure.

This question evaluates understanding of the energetic costs associated with gluconeogenesis, its regulation, and the relationship between different metabolic pathways, encouraging critical analysis of metabolic efficiency and regulation."
3,Biological and Biochemical Foundations of Living Systems,Structure and function of proteins and their constituent amino acids,"### Analytical Question: Structure and Function of Proteins

**Scenario:**

You are studying a specific protein involved in cellular signaling. This protein has several key amino acids that contribute to its structure and function. The following table lists some of these amino acids along with their characteristics:

| Amino Acid | Side Chain Properties        | Role in Protein Structure              | Functional Group   |
|------------|------------------------------|----------------------------------------|---------------------|
| Arginine   | Polar, positively charged     | Stabilizes protein structure through ionic interactions | Guanidinium group   |
| Glutamate  | Polar, negatively charged     | Participates in active sites, often involved in enzyme catalysis | Carboxylic acid     |
| Serine     | Polar, uncharged              | Forms hydrogen bonds, critical for enzyme activity | Hydroxyl group      |
| Leucine    | Nonpolar, hydrophobic         | Contributes to hydrophobic core stability | Aliphatic chain     |

","**Question: What conclusions can be drawn from these data about the roles of specific amino acids in protein structure and function?**

A) The presence of polar and charged amino acids like arginine and glutamate enhances the protein's ability to interact with water, making it more soluble in aqueous environments.  
B) Nonpolar amino acids, such as leucine, are primarily found on the protein surface to interact with the aqueous environment, which stabilizes the protein structure.  
C) Serine's ability to form hydrogen bonds is crucial for the protein's functional properties, particularly in enzyme active sites where substrate binding occurs.  
D) The presence of charged amino acids like arginine and glutamate has no significant effect on protein folding, as hydrophobic interactions dominate overall stability.

### Correct Answer: C) Serine's ability to form hydrogen bonds is crucial for the protein's functional properties, particularly in enzyme active sites where substrate binding occurs.

### Justification and Analysis:

- **Option A:** **Partially Correct but Incomplete.** While polar and charged amino acids do enhance solubility, the statement does not fully address their roles in stabilizing protein structure or their specific functions in enzyme active sites.

- **Option B:** **Incorrect.** Nonpolar amino acids, such as leucine, are typically found in the interior of proteins, contributing to the hydrophobic core. This arrangement minimizes their exposure to water, which is crucial for maintaining protein stability.

- **Option C:** **Correct.** Serine’s hydroxyl group allows it to participate in hydrogen bonding, which is essential for maintaining the structural integrity of active sites in enzymes. This capability is crucial for substrate binding and catalysis.

- **Option D:** **Incorrect.** Charged amino acids like arginine and glutamate play significant roles in protein folding and stability, as they can form ionic bonds and hydrogen bonds. Their presence is critical for the proper conformation and function of proteins, especially in interactions at active sites.

This question encourages critical thinking about the specific roles of amino acids in protein structure and function, highlighting the importance of their chemical properties in biological processes."
4,Biological and Biochemical Foundations of Living Systems,Structure and function of proteins and their constituent amino acids,"### Analytical Question: Structure and Function of Proteins

**Scenario:**

You are examining the properties of various amino acids and how their characteristics impact protein structure and function. The following table summarizes key characteristics of four amino acids:

| Amino Acid | Absolute Configuration | Charge at pH 7.4 | Classification      | Key Features                          |
|------------|-----------------------|-------------------|---------------------|---------------------------------------|
| Aspartic Acid | S (2S,3R)          | Negative           | Acidic              | Contributes to enzyme active sites    |
| Lysine     | S (2S,3R)             | Positive           | Basic                | Forms ionic bonds with negative charges |
| Phenylalanine | S (2S,3R)         | Neutral            | Hydrophobic          | Important for protein folding          |
| Threonine  | S (2S,3S)             | Neutral            | Hydrophilic         | Can form hydrogen bonds                |

","**Question: What conclusions can be drawn from these data about the roles and interactions of these amino acids in protein structure?**

A) The presence of acidic and basic amino acids, such as aspartic acid and lysine, enhances the protein's ability to form salt bridges and stabilize its tertiary structure.  
B) Hydrophobic amino acids like phenylalanine are primarily located on the exterior of proteins, interacting favorably with the aqueous environment.  
C) Threonine's neutral charge at physiological pH suggests it does not significantly contribute to protein interactions, limiting its role in enzyme catalysis.  
D) The absolute configuration of amino acids at the ? position has no bearing on their chemical reactivity or their contribution to protein folding and function.

### Correct Answer: A) The presence of acidic and basic amino acids, such as aspartic acid and lysine, enhances the protein's ability to form salt bridges and stabilize its tertiary structure.

### Justification and Analysis:

- **Option A:** **Correct.** Aspartic acid (acidic) and lysine (basic) can form ionic interactions (salt bridges) due to their charges at physiological pH, which are critical for stabilizing protein tertiary structure and facilitating interactions with other molecules.

- **Option B:** **Incorrect.** Hydrophobic amino acids like phenylalanine are typically found in the interior of proteins, away from the aqueous environment. Their placement helps stabilize protein structure through hydrophobic interactions.

- **Option C:** **Incorrect.** Threonine, although neutral, can participate in hydrogen bonding due to its hydroxyl group, making it significant in protein interactions and potentially in catalysis, especially in enzyme active sites.

- **Option D:** **Incorrect.** The absolute configuration of amino acids at the ? position influences their reactivity and interactions. For example, the spatial arrangement affects how amino acids fold and interact within the protein structure.

This question challenges the understanding of amino acid properties and their implications for protein structure and function, encouraging critical thinking about molecular interactions in biological systems."
5,Biological and Biochemical Foundations of Living Systems,Structure and function of proteins and their constituent amino acids,"### Analytical Question: Protein Structure

**Scenario:**

You are investigating the structural properties of a globular protein that plays a crucial role in enzymatic activity. The protein contains multiple secondary structures, including alpha helices and beta sheets. The following table summarizes the characteristics of various amino acids found in this protein:

| Amino Acid | Side Chain Properties     | Role in Protein Structure             | Common Location       |
|------------|---------------------------|---------------------------------------|-----------------------|
| Cysteine   | Polar, contains sulfur    | Forms disulfide bridges, stabilizing tertiary structure | Often near the surface |
| Glycine    | Small, flexible           | Allows for tight turns in the polypeptide chain | Common in loops       |
| Valine     | Nonpolar, hydrophobic     | Contributes to hydrophobic core stability | Typically buried       |
| Serine     | Polar, uncharged          | Forms hydrogen bonds, important in active sites | Often on the surface   |

","**Question: What conclusions can be drawn from these data regarding the contributions of specific amino acids to the overall stability and function of the protein?**

A) The presence of glycine allows the protein to adopt more rigid structures, thereby enhancing its overall stability.  
B) Cysteine's ability to form disulfide bridges is critical for maintaining the protein's three-dimensional structure, particularly in extracellular environments.  
C) Valine, being hydrophobic, destabilizes the protein structure by promoting interactions with the aqueous environment.  
D) Serine's polar nature limits its interactions within the protein, making it less important for enzymatic function.

### Correct Answer: B) Cysteine's ability to form disulfide bridges is critical for maintaining the protein's three-dimensional structure, particularly in extracellular environments.

### Justification and Analysis:

- **Option A:** **Incorrect.** Glycine contributes to flexibility rather than rigidity. Its small size allows for tight turns in the polypeptide chain, essential for forming flexible regions, not rigid structures.

- **Option B:** **Correct.** Cysteine can form covalent disulfide bonds, which are crucial for stabilizing the tertiary structure of proteins, especially in extracellular environments where oxidative conditions favor disulfide bond formation.

- **Option C:** **Incorrect.** Valine, being hydrophobic, actually stabilizes the protein structure by promoting hydrophobic interactions that help to form a stable core, away from the aqueous environment.

- **Option D:** **Incorrect.** Serine's polar nature allows it to form hydrogen bonds, which are vital for interactions in enzyme active sites and can significantly contribute to the protein's functionality.

This question requires critical thinking about the roles of specific amino acids in protein structure, emphasizing their contributions to stability and functionality within the protein's three-dimensional conformation."
6,Biological and Biochemical Foundations of Living Systems,Structure and function of proteins and their constituent amino acids,"### Analytical Question: Protein Structure

**Scenario:**

You are studying a protein that plays a key role in cellular signaling. Researchers have conducted an experiment to analyze the stability of this protein under varying pH levels and temperatures. The following data summarizes the effects of pH on protein denaturation, measured by the percentage of protein remaining active after exposure to different pH levels (5, 7, 9) at two temperatures (25°C and 37°C):

| pH Level | Temperature (°C) | % Active Protein |
|----------|------------------|------------------|
| 5        | 25               | 85               |
| 5        | 37               | 60               |
| 7        | 25               | 95               |
| 7        | 37               | 70               |
| 9        | 25               | 70               |
| 9        | 37               | 40               |

","**Question: Based on the provided data, what conclusions can be drawn regarding the stability of the protein at different pH levels and temperatures?**

A) The protein is most stable at pH 7 and 25°C, indicating optimal conditions for its activity and suggesting that slight deviations in pH or temperature significantly affect its function.  
B) Increasing temperature always results in higher protein activity, regardless of pH, indicating that the protein is thermally stable.  
C) The data suggest that the protein is more stable at acidic pH levels, as indicated by higher activity percentages at pH 5 compared to pH 9 at both temperatures.  
D) The stability of the protein decreases uniformly across all pH levels when temperature is increased from 25°C to 37°C, indicating that temperature is the primary factor affecting protein denaturation.

### Correct Answer: A) The protein is most stable at pH 7 and 25°C, indicating optimal conditions for its activity and suggesting that slight deviations in pH or temperature significantly affect its function.

### Justification and Analysis:

- **Option A:** **Correct.** The highest percentage of active protein (95%) is observed at pH 7 and 25°C, suggesting that these are optimal conditions for the protein's stability and activity. The significant drop in activity at other pH levels and temperatures indicates that slight deviations can indeed have a profound impact.

- **Option B:** **Incorrect.** The data show that increasing temperature from 25°C to 37°C does not always result in higher protein activity. For example, at pH 5, activity decreases from 85% to 60%, and at pH 9, it decreases from 70% to 40%. Thus, the protein is not thermally stable across all pH levels.

- **Option C:** **Incorrect.** While pH 5 shows higher activity than pH 9 at 25°C, the protein is not more stable at acidic pH levels overall. At both temperatures, pH 7 consistently allows for the highest activity, indicating that neutral pH is more favorable.

- **Option D:** **Incorrect.** The decrease in stability is not uniform across all pH levels when the temperature increases. For instance, at pH 5, the protein's activity drops significantly, while at pH 7, the activity still remains relatively high (70%). This suggests that pH also plays a critical role in stability, not just temperature.

This question requires the integration of scientific reasoning, statistical analysis of the data, and critical thinking to draw meaningful conclusions about protein stability under varying conditions."
7,Biological and Biochemical Foundations of Living Systems,Structure and function of proteins and their constituent amino acids,"### Analytical Question: Non-Enzymatic Protein Function

**Scenario:**

You are studying the binding properties of a non-enzymatic protein involved in the immune response, specifically an antibody. Researchers conducted an experiment to measure the binding affinity of this antibody to an antigen at varying concentrations. The following data shows the observed binding at different antigen concentrations (in nM) and the corresponding binding response measured in arbitrary units (A.U.):

| Antigen Concentration (nM) | Binding Response (A.U.) |
|-----------------------------|--------------------------|
| 1                           | 50                       |
| 5                           | 120                      |
| 10                          | 200                      |
| 20                          | 250                      |
| 50                          | 280                      |
| 100                         | 290                      |

","**Question: Based on the provided data, what conclusions can be drawn regarding the binding characteristics of the antibody?**

A) The antibody exhibits a linear increase in binding response with antigen concentration, suggesting a direct proportionality in the interaction.  
B) The binding response reaches a plateau at higher antigen concentrations, indicating that the antibody may be saturated and that additional antigen does not significantly increase binding.  
C) The highest binding response occurs at the lowest antigen concentration, suggesting that the antibody has a high affinity for the antigen at low concentrations.  
D) The data suggest that the antibody's binding affinity increases as the antigen concentration decreases, making it more effective at lower concentrations.

### Correct Answer: B) The binding response reaches a plateau at higher antigen concentrations, indicating that the antibody may be saturated and that additional antigen does not significantly increase binding.

### Justification and Analysis:

- **Option A:** **Incorrect.** While the binding response increases with antigen concentration, it does not do so linearly. The data show a saturating curve, particularly evident as the binding approaches 290 A.U. at higher concentrations, indicating diminishing returns.

- **Option B:** **Correct.** The binding response levels off after reaching around 290 A.U. at 100 nM, indicating saturation of the antibody binding sites. This suggests that adding more antigen beyond this point will not result in a significant increase in binding response, demonstrating a characteristic of many protein-ligand interactions.

- **Option C:** **Incorrect.** The data clearly show that the highest binding response occurs at 100 nM, not at the lowest concentration. This indicates that higher concentrations of antigen are necessary for maximal binding.

- **Option D:** **Incorrect.** The data suggest that the binding affinity does not increase as the antigen concentration decreases. Instead, the antibody reaches maximal binding at higher concentrations, which is contrary to what this option implies.

This question challenges the understanding of non-enzymatic protein function, specifically in the context of binding interactions, requiring analysis of experimental data to draw conclusions about binding affinity and saturation effects."
